Importance,Category,Task
94,Core,Monitor establishment activities to ensure adherence to all state gaming regulations and company policies and procedures.
93,Core,"Observe casino or casino hotel operations for irregular activities such as cheating or theft by employees or patrons, using audio and video equipment and one-way mirrors."
91,Core,"Report all violations and suspicious behaviors to supervisors, verbally or in writing."
85,Core,Act as oversight or security agents for management or customers.
76,Supplemental,Supervise or train surveillance observers.
